{
  "action": "StoragePromotionPipelineLive",
  "correlation_id": "clm:user123-has_role-admin",
  "created_at": "2026-04-15T20:11:26+00:00",
  "envelope_ref": "event://d3749957-494e-4d3e-a2be-b2518e0940ea",
  "evidence_refs": [],
  "hash": "a0a4b9c2336db835b85805a7c56d12b2aa572d77902f32e27bdc9b7bb6d1e510",
  "hash_algo": "sha256",
  "metrics": {
    "edge_count": 1,
    "entity_count": 2,
    "observation_id": "obs:demo:1:v1",
    "typedb_live_ok": false,
    "typedb_live_requested": true
  },
  "output_refs": [
    "claim://clm:user123-has_role-admin",
    "projection://pmf:neo4j:clm:user123-has_role-admin"
  ],
  "policy_refs": [],
  "receipt_id": "9718f7f3-f2f2-4650-b33e-9866113e847b",
  "service_ref": "apps/storage-promotion",
  "status": "succeeded",
  "subject_ref": "claim://clm:user123-has_role-admin",
  "version": "0.1"
}
